code_rome;code_fiche_metier;code_ogr;libelle_rome;transition_eco;transition_num;transition_demo;emploi_reglemente;emploi_cadre;code_rome_parent
A1101;11;6;Conducteur / Conductrice d'engins agricoles;;;;;;A1101
A1102;30047;403950;Conducteur / Conductrice d'engins d'exploitation forestière;;;;;;A1101
A1201;19;7;Bûcheronnage et élagage;;;;;;
A1202;15;8;Entretien des espaces naturels;;;;;;
A1203;16;9;Aménagement et entretien des espaces verts;;;;;;
A1204;13;10;Protection du patrimoine naturel;;;;;;
A1205;18;11;Sylviculture;;;;;;
A1301;27;12;Conseil et assistance technique en agriculture et environnement naturel;;;;;;
A1302;25;13;Contrôle et diagnostic technique en agriculture;;;;;;
A1303;29;14;Ingénierie en agriculture et environnement naturel;;;;;;
A1304;30050;403951;Conseiller / Conseillère technique agricole;;;;;;A1301
A1401;34;15;Aide agricole de production fruitière ou viticole;;;;;;
A1402;32;16;Aide agricole de production légumière ou végétale;;;;;;
A1403;31;17;Aide d'élevage agricole et aquacole;;;;;;
A1404;52;18;Aquaculture;;;;;;
A1405;43;19;Arboriculture et viticulture;;;;;;
A1406;61;20;Encadrement équipage de la pêche;;;;;;
A1407;45;21;Élevage bovin ou équin;;;;;;
A1408;51;22;Élevage d'animaux sauvages ou de compagnie;;;;;;
A1409;48;23;Élevage de lapins et volailles;;;;;;
A1410;46;24;Élevage ovin ou caprin;;;;;;
A1411;47;25;Élevage porcin;;;;;;
A1412;58;26;Fabrication et affinage de fromages;;;;;;
A1413;60;27;Fermentation de boissons alcoolisées;;;;;;
A1414;37;28;Horticulture et maraîchage;;;;;;
A1415;56;29;Équipage de la pêche;;;;;;
A1416;36;30;Polyculture, élevage;;;;;;
A1417;54;31;Saliculture;;;;;;
A1418;30052;403953;Viticulteur / Viticultrice;;;;;;A1405
A1419;30053;403955;Ouvrier agricole polyvalent / Ouvrière agricole polyvalente;;;;;;A1416
A1420;30051;403956;Chef / Cheffe de culture responsable d'unité de production;;;;;;A1405
A1421;30054;403957;Palefrenier soigneur / Palefrenière soigneuse;;;;;;A1403
A1501;66;32;Aide aux soins animaux;;;;;;
A1502;69;33;Podologie animale;;;;;;
A1503;68;34;Toilettage des animaux;;;;;;
A1504;72;35;Santé animale;;;;;;
B1101;8;36;Création en arts plastiques;;;;;;
B1201;9;37;Réalisation d'objets décoratifs et utilitaires en céramique et matériaux de synthèse;;;;;;
B1301;12;38;Décoration d'espaces de vente et d'exposition;;;;;;
B1302;17;39;Décoration d'objets d'art et artisanaux;;;;;;
B1303;14;40;Gravure - ciselure;;;;;;
B1401;20;41;Réalisation d'objets en lianes, fibres et brins végétaux;;;;;;
B1402;21;42;Reliure et restauration de livres et archives;;;;;;
B1501;22;43;Fabrication et réparation d'instruments de musique;;;;;;
B1601;24;44;Métallerie d'art;;;;;;
B1602;30;45;Réalisation d'objets artistiques et fonctionnels en verre;;;;;;
B1603;26;46;Réalisation d'ouvrages en bijouterie, joaillerie et orfèvrerie;;;;;;
B1604;23;47;Réparation - montage en systèmes horlogers;;;;;;
B1701;33;48;Conservation et reconstitution d'espèces animales;;;;;;
B1801;39;49;Réalisation d'articles de chapellerie;;;;;;
B1802;42;50;Réalisation d'articles en cuir et matériaux souples (hors vêtement);;;;;;
B1803;41;51;Réalisation de vêtements sur mesure ou en petite série;;;;;;
B1804;44;52;Réalisation d'ouvrages d'art en fils;;;;;;
B1805;35;53;Stylisme;;;;;;
B1806;38;54;Tapisserie - décoration en ameublement;;;;;;
C1101;65;55;Conception - développement produits d'assurances;;;;;;
C1102;50;56;Conseil clientèle en assurances;;;;;;
C1103;59;57;Courtage en assurances;;;;;;
C1104;55;58;Direction d'exploitation en assurances;;;;;;
C1105;77;59;Études actuarielles en assurances;;;;;;
C1106;74;60;Expertise risques en assurances;;;;;;
C1107;75;61;Indemnisations en assurances;;;;;;
C1108;57;62;Management de groupe et de service en assurances;;;;;;
C1109;49;63;Rédaction et gestion en assurances;;;;;;
C1110;53;64;Souscription d'assurances;;;;;;
C1201;79;65;Accueil et services bancaires;;;;;;
C1202;93;66;Analyse de crédits et risques bancaires;;;;;;
C1203;88;67;Relation clients banque/finance;;;;;;
C1204;91;68;Conception et expertise produits bancaires et financiers;;;;;;
C1205;30032;69;Conseiller / Conseillère en gestion de patrimoine;;N;N;N;O;C1205
C1206;84;70;Gestion de clientèle bancaire;;;;;;
C1207;90;71;Management en exploitation bancaire;;;;;;
C1208;30033;403084;Courtier / Courtière en banque;;O;N;N;O;C1206
C1301;96;72;Front office marchés financiers;;;;;;
C1302;98;73;Gestion back et middle-office marchés financiers;;;;;;
C1303;95;74;Gestion de portefeuilles sur les marchés financiers;;;;;;
C1401;100;75;Gestion en banque et assurance;;;;;;
C1501;104;76;Gérance immobilière;;;;;;
C1502;102;77;Gestion locative immobilière;;;;;;
C1503;108;78;Management de projet immobilier;;;;;;
C1504;106;79;Conseiller / Conseillère immobilier;;;;;;C1504
C1505;30036;403085;Responsable d'agence immobilière;;N;N;N;O;C1504
D1101;82;80;Boucherie;;;;;;
D1102;78;81;Boulangerie - viennoiserie;;;;;;
D1103;85;82;Charcuterie - traiteur;;;;;;
D1104;80;83;Pâtisserie, confiserie, chocolaterie et glacerie;;;;;;
D1105;87;84;Poissonnerie;;;;;;
D1106;76;85;Vente en alimentation;;;;;;
D1107;73;86;Vente en gros de produits frais;;;;;;
D1201;101;87;Achat vente d'objets d'art, anciens ou d'occasion;;;;;;
D1202;109;88;Coiffure;;;;;;
D1203;113;89;Hydrothérapie;;;;;;
D1204;117;90;Location de véhicules ou de matériel de loisirs;;;;;;
D1205;115;91;Nettoyage d'articles textiles ou cuirs;;;;;;
D1206;105;92;Réparation d'articles en cuir et matériaux souples;;;;;;
D1207;103;93;Retouches en habillement;;;;;;
D1208;111;94;Soins esthétiques et corporels;;;;;;
D1209;99;95;Vente de végétaux;;;;;;
D1210;89;96;Vente en animalerie;;;;;;
D1211;107;97;Vente en articles de sport et loisirs;;;;;;
D1212;94;98;Vente en décoration et équipement du foyer;;;;;;
D1213;92;99;Vente en gros de matériel et équipement;;;;;;
D1214;97;100;Vente en habillement et accessoires de la personne;;;;;;
D1301;120;101;Management de magasin de détail;;;;;;
D1401;30031;102;Assistant commercial / Assistante commerciale;;O;N;N;O;D1401
D1402;124;103;Relation commerciale grands comptes et entreprises;;;;;;
D1403;127;104;Relation commerciale auprès de particuliers;;;;;;
D1404;129;105;Relation commerciale en vente de véhicules;;;;;;
D1405;131;106;Conseil en information médicale;;;;;;
D1406;135;107;Management en force de vente;;;;;;
D1407;30030;108;Technico-commercial / Technico-commerciale;;N;N;N;O;D1407
D1408;122;109;Téléconseil et télévente;;;;;;
D1409;125;403074;Gestion administrative des ventes;;;;;;D1401
D1410;30034;403086;Attaché commercial / Attachée commerciale;;N;N;N;O;D1401
D1501;30035;110;Animateur / Animatrice des ventes;;N;N;N;N;D1501
D1502;141;111;Management/gestion de rayon produits alimentaires;;;;;;
D1503;142;112;Management/gestion de rayon produits non alimentaires;;;;;;
D1504;150;113;Direction de magasin de grande distribution;;;;;;
D1505;139;114;Personnel de caisse;;;;;;
D1506;152;115;Marchandisage;;;;;;
D1507;137;116;Mise en rayon libre-service;;;;;;
D1508;144;117;Encadrement du personnel de caisses;;;;;;
D1509;148;118;Responsable grande distribution;;;;;;D1509
D1510;30038;403087;Chef / Cheffe de secteur commercial;;N;N;N;O;D1509
E1101;112;119;Animation de site multimédia;;O;;;;
E1102;110;120;Écriture d'ouvrages, de livres;;;;;;
E1103;121;121;Chargé / Chargée de communication;;O;;;;E1103
E1104;119;122;Conception de contenus multimédias;;;;;;
E1105;123;123;Coordination d'édition;;;;;;
E1106;116;124;Journalisme et information média;;;;;;
E1107;30037;125;Chef / Cheffe de projet événementiel;;O;N;N;O;E1107
E1108;126;126;Traduction, interprétariat;;;;;;
E1109;30039;403088;Directeur / Directrice de la communication;;N;N;N;O;E1103
E1201;128;127;Photographie;;;;;;
E1202;138;128;Production en laboratoire cinématographique;;;;;;
E1203;136;129;Production en laboratoire photographique;;;;;;
E1204;582;130;Projection cinéma;;;;;;
E1205;134;131;Réalisation de contenus multimédias;;O;;;;
E1206;30071;404036;UX - UI Designer;;O;;;;E1205
E1301;149;132;Conduite de machines d'impression;;;;;;
E1302;140;133;Conduite de machines de façonnage routage;;;;;;
E1303;153;134;Encadrement des industries graphiques;;;;;;
E1304;151;135;Façonnage et routage;;;;;;
E1305;145;136;Préparation et correction en édition et presse;;;;;;
E1306;147;137;Prépresse;;;;;;
E1307;143;138;Reprographie;;;;;;
E1308;154;139;Intervention technique en industrie graphique;;;;;;
E1401;156;140;Développement et promotion publicitaire;;;;;;
E1402;157;141;Élaboration de plan média;;;;;;
F1101;161;142;Architecture du BTP et du paysage;;;;;;
F1102;30040;143;Architecte d'intérieur;;O;N;N;O;F1102
F1103;169;144;Contrôle et diagnostic technique du bâtiment;;;;;;
F1104;163;145;Dessin BTP et paysage;;;;;;
F1105;172;146;Études géologiques;;;;;;
F1106;167;147;Ingénierie et études du BTP;;;;;;
F1107;30043;148;Géomètre-topographe;;O;N;O;O;F1107
F1108;171;149;Métré de la construction;;;;;;
F1109;165;403075;Mesures topographiques;;;;;;F1107
F1110;30024;403079;Dessinateur / Dessinatrice enveloppe du bâtiment;;;;;;F1104
F1111;30041;403089;Ingénieur / Ingénieure génie civil;;O;N;N;O;F1106
F1112;30042;403090;Ingénieur / Ingénieure calcul et structure;;O;N;N;O;F1106
F1201;30044;150;Conducteur / Conductrice de travaux;;N;N;N;O;F1201
F1202;30045;151;Chef / Cheffe de chantier;;O;N;N;O;F1202
F1203;180;152;Direction et ingénierie d'exploitation de gisements et de carrières;;;;;;
F1204;174;153;Qualité Sécurité Environnement et protection santé du BTP;;;;;;
F1205;178;403076;Responsable de travaux BTP;;;;;;F1201
F1301;184;154;Conduite de grue;;;;;;
F1302;182;155;Conduite d'engins de terrassement et de carrière;;;;;;
F1401;187;156;Extraction liquide et gazeuse;;;;;;
F1402;185;157;Extraction solide;;;;;;
F1501;190;158;Montage de structures et de charpentes bois;;;;;;
F1502;188;159;Montage de structures métalliques;;;;;;
F1503;192;160;Réalisation - installation d'ossatures bois;;;;;;
F1601;220;161;Application et décoration en plâtre, stuc et staff;;;;;;
F1602;199;162;Électricité bâtiment;;;;;;
F1603;204;163;Installation d'équipements sanitaires et thermiques;;;;;;
F1604;207;164;Montage d'agencements;;;;;;
F1605;201;165;Montage de réseaux électriques et télécoms;;O;;;;
F1606;212;166;Peintre en bâtiment;;;;;;F1606
F1607;30029;167;Menuisier / Menuisière aluminium;;;;;;F1607
F1608;209;168;Pose de revêtements rigides;;;;;;
F1609;211;169;Pose de revêtements souples;;;;;;
F1610;196;170;Pose et restauration de couvertures;;;;;;
F1611;215;171;Réalisation et restauration de façades;;;;;;
F1612;217;172;Taille et décoration de pierres;;;;;;
F1613;197;173;Travaux d'étanchéité et d'isolation;;;;;;
F1614;206;403073;Poseur / Poseuse en fermetures de bâtiment;;;;;;F1607
F1615;30025;403080;Poseur / Poseuse de cloisons démontables et mobiles;;;;;;F1604
F1616;30026;403081;Poseur / Poseuse de menuiseries extérieures;;;;;;F1607
F1617;30028;403082;Poseur / Poseuse de véranda;;;;;;F1607
F1618;30027;403083;Poseur / Poseuse de façade vitrée;;;;;;F1611
F1619;30062;404037;Couvreur / Couvreuse;;;;O;;F1610
F1701;227;174;Construction en béton;;;;;;
F1702;224;175;Construction de routes et voies;;;;;;
F1703;229;176;Maçonnerie;;;;;;
F1704;222;177;Préparation du gros oeuvre et des travaux publics;;;;;;
F1705;225;178;Pose de canalisations;;;;;;
F1706;231;179;Préfabrication en béton industriel;;;;;;
F1707;30048;403952;Maçon / Maçonne du paysage;;;;;;F1703
F1708;30049;403954;Installateur-poseur / Installatrice-poseuse de piscines préfabriquées;;;;;;F1703
F1709;30057;404038;Démolisseur / Démolisseuse;;;;N;;F1704
G1101;160;180;Accueil touristique;;;;;;
G1102;162;181;Promotion du tourisme local;;;;;;
G1201;175;182;Accompagnement de voyages, d'activités culturelles ou sportives;;;;;;
G1202;166;183;Animation d'activités culturelles ou ludiques;;;;;;
G1203;164;184;Animation de loisirs auprès d'enfants ou d'adolescents;;;;;;
G1204;30020;185;Éducateur sportif / Éducatrice sportive;;N;N;O;N;G1204
G1205;170;186;Personnel d'attractions ou de structures de loisirs;;;;;;
G1206;173;187;Personnel technique des jeux;;;;;;
G1207;168;403072;Moniteur / Monitrice de sport;;;;;;G1204
G1208;30021;403077;Entraîneur / Entraîneure de sport professionnel et de haut niveau;;N;N;O;N;G1204
G1209;30022;403078;Animateur de loisirs sportifs / Animatrice de loisirs sportifs;;N;N;O;N;G1204
G1210;30055;403958;Enseignant / Enseignante d'équitation;;;;;;G1204
G1301;179;188;Conception de produits touristiques;;;;;;
G1302;181;189;Optimisation de produits touristiques;;;;;;
G1303;177;190;Vente de voyages;;;;;;
G1401;595;191;Assistance de direction d'hôtel-restaurant;;;;;;
G1402;186;192;Management d'hôtel-restaurant;;;;;;
G1403;191;193;Gestion de structure de loisirs ou d'hébergement touristique;;;;;;
G1404;189;194;Responsable d'établissement de restauration collective;;;;;O;G1404
G1501;195;195;Personnel d'étage;;;;;;
G1502;193;196;Personnel polyvalent d'hôtellerie;;;;;;
G1503;198;197;Management du personnel d'étage;;;;;;
G1601;30046;198;Chef / Cheffe de cuisine;;N;N;N;O;G1601
G1602;205;199;Personnel de cuisine;;;;;;
G1603;208;200;Personnel polyvalent en restauration;;;;;;
G1604;200;201;Fabrication de crêpes ou pizzas;;;;;;
G1605;202;202;Plonge en restauration;;;;;;
G1606;30058;404039;Cuisinier / Cuisinière de collectivité;;;;;;G1602
G1607;30063;404040;Employé / Employée de restauration collective;;;;;;G1603
G1701;218;203;Conciergerie en hôtellerie;;;;;;
G1702;213;204;Personnel du hall;;;;;;
G1703;216;205;Réception en hôtellerie;;;;;;
G1801;223;206;Café, bar brasserie;;;;;;
G1802;228;207;Management du service en restauration;;;;;;
G1803;219;208;Service en restauration;;;;;;
G1804;221;209;Sommellerie;;;;;;
H1101;230;210;Assistance et support technique client;;;;;;
H1102;232;211;Management et ingénierie d'affaires;;;;;;
H1201;254;212;Expertise technique couleur en industrie;;;;;;
H1202;242;213;Conception et dessin de produits électriques et électroniques;;;;;;
H1203;237;214;Conception et dessin produits mécaniques;;;;;;
H1204;234;215;Design industriel;;;;;;
H1205;257;216;Études - modèles en industrie des matériaux souples;;;;;;
H1206;252;217;Management et ingénierie études, recherche et développement industriel;;;;;;
H1207;250;218;Rédaction technique;;;;;;
H1208;247;219;Intervention technique en études et conception en automatisme;;O;;;;
H1209;240;220;Intervention technique en études et développement électronique;;;;;;
H1210;244;221;Intervention technique en études, recherche et développement;;O;O;;;
H1301;262;222;Inspection de conformité;;;;;;
H1302;264;223;Management et ingénierie Hygiène Sécurité Environnement -HSE- industriels;;;;;;
H1303;259;224;Intervention technique en Hygiène Sécurité Environnement -HSE- industriel;;;;;;
H1401;274;225;Management et ingénierie gestion industrielle et logistique;;;;;;
H1402;270;226;Management et ingénierie méthodes et industrialisation;;;;;;
H1403;268;227;Intervention technique en gestion industrielle et logistique;;;;;;
H1404;266;228;Intervention technique en méthodes et industrialisation;;;;;;
H1501;282;229;Direction de laboratoire d'analyse industrielle;;;;;;
H1502;284;230;Management et ingénierie qualité industrielle;;;;;;
H1503;281;231;Intervention technique en laboratoire d'analyse industrielle;;;;;;
H1504;280;232;Intervention technique en contrôle essai qualité en électricité et électronique;;;;;;
H1505;276;233;Intervention technique en formulation et analyse sensorielle;;;;;;
H1506;278;234;Intervention technique qualité en mécanique et travail des métaux;;;;;;
H2101;288;235;Abattage et découpe des viandes;;;;;;
H2102;286;236;Conduite d'équipement de production alimentaire;;;;;;
H2103;30056;403959;Opérateur / Opératrice de transformation des viandes;;;;;;H2101
H2201;294;237;Assemblage d'ouvrages en bois;;;;;;
H2202;293;238;Conduite d'équipement de fabrication de l'ameublement et du bois;;;;;;
H2203;289;239;Conduite d'installation de production de panneaux bois;;;;;;
H2204;300;240;Encadrement des industries de l'ameublement et du bois;;;;;;
H2205;291;241;Première transformation de bois d'oeuvre;;;;;;
H2206;296;242;Réalisation de menuiserie bois et tonnellerie;;;;;;
H2207;298;243;Réalisation de meubles en bois;;;;;;
H2208;299;244;Réalisation d'ouvrages décoratifs en bois;;;;;;
H2209;302;245;Intervention technique en ameublement et bois;;;;;;
H2301;303;246;Conduite d'équipement de production chimique ou pharmaceutique;;;;;;
H2401;307;247;Assemblage - montage d'articles en cuirs, peaux;;;;;;
H2402;308;248;Assemblage - montage de vêtements et produits textiles;;;;;;
H2403;320;249;Conduite de machine de fabrication de produits textiles;;;;;;
H2404;317;250;Conduite de machine de production et transformation des fils;;;;;;
H2405;322;251;Conduite de machine de textiles nontissés;;;;;;
H2406;326;252;Conduite de machine de traitement textile;;;;;;
H2407;324;253;Conduite de machine de transformation et de finition des cuirs et peaux;;;;;;
H2408;327;254;Conduite de machine d'impression textile;;;;;;
H2409;315;255;Coupe cuir, textile et matériaux souples;;;;;;
H2410;311;256;Mise en forme, repassage et finitions en industrie textile;;;;;;
H2411;310;257;Montage de prototype cuir et matériaux souples;;;;;;
H2412;305;258;Patronnage - gradation;;;;;;
H2413;318;259;Préparation de fils, montage de métiers textiles;;;;;;
H2414;312;260;Préparation et finition d'articles en cuir et matériaux souples;;;;;;
H2415;313;261;Contrôle en industrie du cuir et du textile;;;;;;
H2501;330;262;Encadrement de production de matériel électrique et électronique;;;;;;
H2502;334;263;Management et ingénierie de production;;;;;;
H2503;329;264;Pilotage d'unité élémentaire de production mécanique ou de travail des métaux;;;;;;
H2504;332;265;Encadrement d'équipe en industrie de transformation;;;;;;
H2505;336;266;Encadrement d'équipe ou d'atelier en matériaux souples;;;;;;
H2601;358;267;Bobinage électrique;;;;;;
H2602;353;268;Câblage électrique et électromécanique;;;;;;
H2603;352;269;Conduite d'installation automatisée de production électrique, électronique et microélectronique;;;;;;
H2604;350;270;Montage de produits électriques et électroniques;;;;;;
H2605;356;271;Montage et câblage électronique;;;;;;
H2701;359;272;Pilotage d'installation énergétique et pétrochimique;;;;;;
H2801;363;273;Conduite d'équipement de transformation du verre;;;;;;
H2802;366;274;Conduite d'installation de production de matériaux de construction;;;;;;
H2803;368;275;Façonnage et émaillage en industrie céramique;;;;;;
H2804;364;276;Pilotage de centrale à béton prêt à l'emploi, ciment, enrobés et granulats;;;;;;
H2805;361;277;Pilotage d'installation de production verrière;;;;;;
H2901;385;278;Ajustement et montage de fabrication;;;;;;
H2902;601;279;Chaudronnerie - tôlerie;;;;;;
H2903;377;280;Conduite d'équipement d'usinage;;;;;;
H2904;374;281;Conduite d'équipement de déformation des métaux;;;;;;
H2905;373;282;Conduite d'équipement de formage et découpage des matériaux;;;;;;
H2906;371;283;Conduite d'installation automatisée ou robotisée de fabrication mécanique;;;;;;
H2907;389;284;Conduite d'installation de production des métaux;;;;;;
H2908;391;285;Modelage de matériaux non métalliques;;;;;;
H2909;378;286;Montage-assemblage mécanique;;;;;;
H2910;393;287;Moulage sable;;;;;;
H2911;382;288;Réalisation de structures métalliques;;;;;;
H2912;387;289;Réglage d'équipement de production industrielle;;;;;;
H2913;380;290;Soudage manuel;;;;;;
H2914;384;291;Réalisation et montage en tuyauterie;;;;;;
H3101;396;292;Conduite d'équipement de fabrication de papier ou de carton;;;;;;
H3102;395;293;Conduite d'installation de pâte à papier;;;;;;
H3201;401;294;Conduite d'équipement de formage des plastiques et caoutchoucs;;;;;;
H3202;402;295;Réglage d'équipement de formage des plastiques et caoutchoucs;;;;;;
H3203;398;296;Fabrication de pièces en matériaux composites;;;;;;
H3301;404;297;Conduite d'équipement de conditionnement;;;;;;
H3302;405;298;Opérations manuelles d'assemblage, tri ou emballage;;;;;;
H3303;407;299;Préparation de matières et produits industriels (broyage, mélange, ...);;;;;;
H3401;414;300;Conduite de traitement d'abrasion de surface;;;;;;
H3402;410;301;Conduite de traitement par dépôt de surface;;;;;;
H3403;409;302;Conduite de traitement thermique;;;;;;
H3404;411;303;Peinture industrielle;;;;;;
I1101;239;304;Direction et ingénierie en entretien infrastructure et bâti;;;;;;
I1102;236;305;Management et ingénierie de maintenance industrielle;;;;;;
I1103;583;306;Supervision d'entretien et gestion de véhicules;;;;;;
I1201;246;307;Entretien d'affichage et mobilier urbain;;;;;;
I1202;243;308;Entretien et surveillance du tracé routier;;;;;;
I1203;241;309;Maintenance des bâtiments et des locaux;;;;;;
I1301;260;310;Installation et maintenance d'ascenseurs;;;;;;
I1302;258;311;Installation et maintenance d'automatismes;;;;;;
I1303;248;312;Installation et maintenance de distributeurs automatiques;;;;;;
I1304;256;313;Installation et maintenance d'équipements industriels et d'exploitation;;;;;;
I1305;265;314;Installation et maintenance électronique;;;;;;
I1306;263;315;Installation et maintenance en froid, conditionnement d'air;;;;;;
I1307;253;316;Installation et maintenance télécoms et courants faibles;;;;;;
I1308;261;317;Maintenance d'installation de chauffage;;;;;;
I1309;251;318;Maintenance électrique;;;;;;
I1310;249;319;Maintenance mécanique industrielle;;;;;;
I1401;267;320;Maintenance informatique et bureautique;;O;;;;
I1402;271;321;Réparation de biens électrodomestiques et multimédia;;;;;;
I1501;275;322;Intervention en grande hauteur;;;;;;
I1502;277;323;Intervention en milieu subaquatique;;;;;;
I1503;273;324;Intervention en milieux et produits nocifs;;;;;;
I1601;279;325;Installation et maintenance en nautisme;;;;;;
I1602;292;326;Maintenance d'aéronefs;;;;;;
I1603;584;327;Maintenance d'engins de chantier, levage, manutention et de machines agricoles;;;;;;
I1604;285;328;Mécanique automobile et entretien de véhicules;;;;;;
I1605;283;329;Mécanique de marine;;;;;;
I1606;290;330;Réparation de carrosserie;;;;;;
I1607;287;331;Réparation de cycles, motocycles et motoculteurs de loisirs;;;;;;
J1101;295;332;Médecine de prévention;;;O;;;
J1102;297;333;Médecine généraliste et spécialisée;;;O;;;
J1103;301;334;Médecine dentaire;;;O;;;
J1104;304;335;Suivi de la grossesse et de l'accouchement;;;O;;;
J1105;30064;404041;Médecin coordonnateur;;;O;O;O;J1102
J1201;306;336;Biologie médicale;;;O;;;
J1202;309;337;Pharmacie;;;O;;;
J1301;316;338;Agent / Agente de service hospitalier (ASH);;;;N;N;J1301
J1302;325;339;Analyses médicales;;;O;;;
J1303;319;340;Assistance médico-technique;;;;;;
J1304;314;341;Auxiliaire de puériculture;;N;N;O;N;J1304
J1305;321;342;Conduite de véhicules sanitaires;;;;;;
J1306;328;343;Imagerie médicale;;;O;;;
J1307;323;344;Préparation en pharmacie;;;O;;;
J1308;30059;404042;Brancardier / Brancardière;;;;;;J1301
J1309;30065;404043;Agent / Agente de stérilisation de service hospitalier;;N;N;N;N;J1301
J1401;335;345;Audioprothèses;;;O;;;
J1402;338;346;Diététique;;;O;;;
J1403;340;347;Ergothérapie;;;O;;;
J1404;331;348;Kinésithérapie;;;O;;;
J1405;341;349;Optique - lunetterie;;;O;;;
J1406;342;350;Orthophonie;;;O;;;
J1407;343;351;Orthoptique;;;O;;;
J1408;333;352;Ostéopathie et chiropraxie;;;O;;;
J1409;344;353;Pédicurie et podologie;;;O;;;
J1410;345;354;Prothèses dentaires;;;O;;;
J1411;346;355;Prothèses et orthèses;;;O;;;
J1412;347;356;Rééducation en psychomotricité;;;O;;;
J1501;349;357;Aide-soignant / Aide-soignante;;N;O;O;N;J1501
J1502;357;358;Coordination de services médicaux ou paramédicaux;;;O;;;
J1503;351;359;Infirmier / Infirmière anesthésiste (IADE);;;;O;;J1503
J1504;360;360;Infirmier / Infirmière de bloc opératoire (IBODE);;O;N;O;N;J1504
J1505;354;361;Soins infirmiers spécialisés en prévention;;;O;;;
J1506;355;362;Infirmier / Infirmière en soins généraux (IDE);;;O;O;N;J1506
J1507;362;363;Infirmier / Infirmière en puériculture;;N;N;O;N;J1507
K1101;365;364;Accompagnement et médiation familiale;;;;;;
K1102;367;365;Aide aux bénéficiaires d'une mesure de protection juridique;;;;;;
K1103;370;366;Développement personnel et bien-être de la personne;;;O;;;
K1104;372;367;Psychologie;;;O;;;
K1201;590;368;Action sociale;;;;;;
K1202;381;369;Éducation de jeunes enfants;;;;;;
K1203;386;370;Encadrement technique en insertion professionnelle;;;;;;
K1204;589;371;Médiation sociale et facilitation de la vie en société;;;;;;
K1205;602;372;Information sociale;;;;;;
K1206;379;373;Intervention socioculturelle;;;;;;
K1207;383;374;Intervention socioéducative;;;;;;
K1301;388;375;Accompagnement médicosocial;;;;;;
K1302;392;376;Assistance auprès d'adultes;;;O;;;
K1303;394;377;Assistance auprès d'enfants;;;O;;;
K1304;390;378;Services domestiques;;;O;;;
K1305;615;28964;Intervention sociale et familiale;;;;;;
K1306;30066;404044;Auxiliaire de Vie Sociale (AVS);;;O;N;N;K1302
K1307;30067;404045;Animateur / Animatrice petite enfance;;;;N;N;K1303
K1308;30068;404046;Agent territorial spécialisé / Agente territoriale spécialisée des écoles maternelles (ATSEM);;;;;;K1303
K1401;397;379;Conception et pilotage de la politique des pouvoirs publics;;;;;;
K1402;406;380;Conseil en Santé Publique;;;O;;;
K1403;592;381;Management de structure de santé, sociale ou pénitentiaire;;;O;;;
K1404;400;382;Mise en oeuvre et pilotage de la politique des pouvoirs publics;;;;;;
K1405;403;383;Représentation de l'État sur le territoire national ou international;;;;;;
K1501;419;384;Application des règles financières publiques;;;;;;
K1502;428;385;Contrôle et inspection des Affaires Sociales;;;;;;
K1503;421;386;Contrôle et inspection des impôts;;;;;;
K1504;426;387;Contrôle et inspection du Trésor Public;;;;;;
K1505;423;388;Protection des consommateurs et contrôle des échanges commerciaux;;;;;;
